index	task	verb	sentence	neg_sentence	complement	turker_pos_ratings	turker_neg_ratings	bert_pos_entailment_prob	bert_pos_contradiction_prob	bert_pos_neutral_prob	bert_neg_entailment_prob	bert_neg_contradiction_prob	bert_neg_neutral_prob	signature
768	that	remember	A witness remembered that there were four simultaneous decisionmaking processes going on at once.	A witness did not remember that there were four simultaneous decisionmaking processes going on at once.	There were four simultaneous decisionmaking processes going on at once.	0.0,0.0,2.0	0.0,1.0,1.0	0.998207	0.00022155094	0.0015714251999999998	0.9880539	0.0020386510000000003	0.009907479	+/+
769	that	remember	She remembered that this was one of the men Tommy was shadowing when she had last seen him.	She did not remember that this was one of the men Tommy was shadowing when she had last seen him.	This was one of the men tommy was shadowing when she had last seen him.	1.0,2.0,2.0	0.0,1.0,1.0	0.9978358	0.0006488451	0.0015153482	0.9342121	0.051753867	0.014033941	+/+
770	that	remember	She remembered that she had had no tea, but felt too excited to be conscious of hunger.	She did not remember that she had had no tea, but felt too excited to be conscious of hunger.	She had had no tea.	0.0,2.0,2.0	1.0,2.0,2.0	0.9975255	0.00038841588	0.0020861458	0.993096	0.0011581967999999998	0.0057458486	+/+
771	that	remember	Then I remembered that it was Sir James who had discovered the false Jane Finn.	Then I did not remember that it was Sir James who had discovered the false Jane Finn.	It was sir james who had discovered the false jane finn.	0.0,2.0,2.0	-1.0,1.0,1.0	0.99716353	0.0007332958599999999	0.0021031536	0.974173	0.012026115	0.013800785	+/+
772	that	remember	Scuba divers remember that coral is plentiful so you might as well take some.	Scuba divers do not remember that coral is plentiful so you might as well take some.	Coral is plentiful so you might as well take some.	1.0,2.0,2.0	0.0,0.0,0.0	0.998478	0.00017539274	0.0013465226000000002	0.99307334	0.0009667014	0.0059598912	+/+
773	that	remember	I remembered that Cynthia had begun her confidences in much the same way. 	I did not remember that Cynthia had begun her confidences in much the same way. 	Cynthia had begun her confidences in much the same way.	1.0,2.0,2.0	0.0,0.0,1.0	0.998331	0.00019675927	0.0014722456	0.97540885	0.008230636999999999	0.016360547	+/+
774	that	remember	Then he remembered that there was a good supply in Julius's sitting-room.	Then he did not remember that there was a good supply in Julius's sitting-room.	There was a good supply in julius's sitting-room.	1.0,1.0,2.0	1.0,1.0,1.0	0.99726105	0.00015429636	0.002584668	0.04043792	0.015088496000000003	0.9444735	+/+
775	that	remember	She remembered that Sir James said she should keep some secrets.	She did not remember that Sir James said she should keep some secrets.	Sir james said she should keep some secrets.	1.0,2.0,2.0	0.0,0.0,1.0	0.997943	0.00035231793	0.0017046195	0.9930894	0.0019238829	0.0049866927	+/+
776	that	remember	He remembered that Sagittarius was one of the Zodiac signs.	He did not remember that Sagittarius was one of the Zodiac signs.	Sagittarius was one of the zodiac signs.	1.0,2.0,2.0	0.0,1.0,1.0	0.9981548	0.00019389452	0.0016511582	0.9821809	0.0048297658	0.012989328	+/+
777	that	demonstrate	In particular, applying the model demonstrates that the burden of USO is very great for Poste Italiane and other posts with small per capita volumes.	In particular, applying the model does not demonstrate that the burden of USO is very great for Poste Italiane and other posts with small per capita volumes.	The burden of uso is very great for poste italiane and other posts with small per capita volumes.	1.0,2.0,2.0	-1.0,-1.0,0.0	0.9983766	0.00023216452	0.0013911178	0.3274339000000001	0.24398051	0.4285856	+/o
778	that	demonstrate	The analysis of delivery costs for France and the U.S. demonstrates that street delivery costs are more heterogeneous in France than in the U.S.	The analysis of delivery costs for France and the U.S. does not demonstrate that street delivery costs are more heterogeneous in France than in the U.S.	Street delivery costs are more heterogeneous in france than in the u.s..	1.0,1.0,2.0	-1.0,-1.0,-1.0	0.9929155	0.0043078396	0.0027765483000000003	0.008886867	0.98004776	0.011065446	+/o
779	that	demonstrate	They also gained control of most of their manufacturing processes and demonstrated that the products were reliable before entering production.	They also gained control of most of their manufacturing processes and did not demonstrate that the products were reliable before entering production.	The products were reliable before entering production.	1.0,1.0,2.0	-1.0,0.0,0.0	0.9952272	0.0002900956	0.0044826893	0.055824026	0.06871923	0.8754566999999999	+/o
780	that	demonstrate	The results demonstrated that our process is a useful and effective tool for assessing the quality of legal services delivery.	The results did not demonstrate that our process is a useful and effective tool for assessing the quality of legal services delivery.	Our process is a useful and effective tool for assessing the quality of legal services delivery.	1.0,2.0,2.0	-1.0,-1.0,0.0	0.99782586	0.0001429647	0.002031214	0.22888845	0.094261	0.6768506	+/o
781	that	demonstrate	Japan's economy over the 1990s demonstrated that high saving can coincide with economic stagnation.	Japan's economy over the 1990s did not demonstrate that high saving can coincide with economic stagnation.	High saving can coincide with economic stagnation.	2.0,2.0,2.0	-1.0,0.0,0.0	0.99801993	0.00015658575	0.0018235488	0.5277863	0.044231027	0.4279827000000001	+/o
782	that	demonstrate	It demonstrates that the Italians prefer architecture over pictorial qualities.	It does not demonstrate that the Italians prefer architecture over pictorial qualities.	The italians prefer architecture over pictorial qualities.	1.0,1.0,1.0	-1.0,0.0,0.0	0.99704164	0.0014497038	0.0015086709	0.072370276	0.8658261999999999	0.0618035	+/o
783	that	see	I see that you have more important things to attend to.	I do not see that you have more important things to attend to.	You have more important things to attend to.	2.0,2.0,2.0	-2.0,-1.0,1.0	0.99815327	0.00021315066	0.0016335805	0.017148383	0.9665568	0.016294895	+/+
784	that	see	He is married and everyone has seen that he is having an affair.	He is married and everyone has not seen that he is having an affair.	He is having an affair.	1.0,2.0,2.0	-2.0,-1.0,1.0	0.98954564	0.0013015001	0.009152915	0.17357641	0.015457216	0.81096643	+/+
785	that	explain	Quayle may be a formidable candidate, but the subsequent article explains that George W. Bush has already been anointed the inevitable one.	Quayle may be a formidable candidate, but the subsequent article does not explain that George W. Bush has already been anointed the inevitable one.	George w. bush has already been anointed the inevitable one.	1.0,1.0,2.0	-1.0,1.0,2.0	0.9969559	0.00048986106	0.0025542933	0.6067684	0.11863351	0.274598	o/+
786	that	see	I've seen that coincidences, once started, seem to continue happening in crazy ways.	I've not seen that coincidences, once started, seem to continue happening in crazy ways.	Coincidences, once started, seem to continue happening in crazy ways.	1.0,1.0,1.0	-1.0,-1.0,0.0	0.99834096	0.0001739109	0.0014851107	0.99698263	0.0004732629	0.0025441414000000003	+/+
787	that	hold	Relativists hold that religious texts written centuries ago must be interpreted within the cultural and historical context of their times.	Relativists do not hold that religious texts written centuries ago must be interpreted within the cultural and historical context of their times.	Religious texts written centuries ago must be interpreted within the cultural and historical context of their times.	1.0,2.0,2.0	-1.0,-1.0,-1.0	0.99765116	0.0003704902	0.0019783813	0.0015173432	0.99582905	0.0026536088	o/o
788	that	hold	One theory holds that young white girls -lrb-unlike young black girls-rrb- subscribe to a cult of thinness, and smoke to block their appetite.	One theory does not hold that young white girls -lrb-unlike young black girls-rrb- subscribe to a cult of thinness, and smoke to block their appetite.	Young white girls -lrb- unlike young black girls -rrb- subscribe to a cult of thinness, and smoke to block their appetite.	0.0,1.0,2.0	-1.0,-1.0,0.0	0.99797076	0.0009670943	0.0010620855	0.99009323	0.0057275514	0.004179318	o/o
789	that	hold	Legend holds that this gorge was created by the saber of Manjushri -lrb-see page 15-rrb-.	Legend does not hold that this gorge was created by the saber of Manjushri -lrb-see page 15-rrb-.	This gorge was created by the saber of manjushri.	0.0,1.0,2.0	-2.0,-1.0,0.0	0.997416	0.0009593101	0.0016246192000000002	0.91062534	0.070475176	0.01889947	o/o
790	that	hold	The Hindu faith holds that Delhi is the second oldest city.	The Hindu faith does not hold that Delhi is the second oldest city.	Delhi is the second oldest city.	0.0,0.0,2.0	-1.0,0.0,0.0	0.99257463	0.0021650954000000003	0.0052601635	0.1907326	0.28051844	0.528749	o/o
791	that	complain	Yet the senator is trying to kill Lee's nomination, complaining that he might be an activist at the Justice Department.	Yet the senator is trying to kill Lee's nomination, not complaining that he might be an activist at the Justice Department.	He might be an activist at the justice department.	0.0,1.0,2.0	0.0,1.0,2.0	0.99293846	0.00037946965	0.006682089	0.9931213	0.00034281734	0.006535795	o/o
792	that	complain	Many members complain that the Farrakhan spends too much money when it could be going towards the cause.	Many members do not complain that the Farrakhan spends too much money when it could be going towards the cause.	The farrakhan spends too much money when it could be going towards the cause.	0.0,1.0,1.0	0.0,0.0,0.0	0.9961875	0.0009700357	0.0028425055	0.9246517	0.038822696	0.036525633	o/o
793	that	complain	At other times they complain that workfarers have taken good, desirable union jobs away from others.	At other times they do not complain that workfarers have taken good, desirable union jobs away from others.	Workfarers have taken good, desirable union jobs away from others.	0.0,1.0,1.0	0.0,0.0,1.0	0.99341565	0.001532319	0.0050519784000000005	0.9892984	0.0023263467	0.008375308	o/o
794	that	complain	Welfare advocates are already complaining that recipients will be pushed into dead-end jobs.	Welfare advocates are already not complaining that recipients will be pushed into dead-end jobs.	Recipients will be pushed into dead-end jobs.	1.0,1.0,1.0	0.0,0.0,0.0	0.01184042	0.0038967014	0.9842629	0.05629142	0.012196649	0.93151194	o/o
795	that	complain	Others complain that the superstars are over the hill, and are trotting out mediocre work.	Others do not complain that the superstars are over the hill, and are trotting out mediocre work.	The superstars are over the hill.	0.0,0.0,1.0	-1.0,0.0,2.0	0.98412526	0.006499251	0.009375543	0.9873729	0.00377246	0.008854739	o/o
796	that	complain	Overall, parents complain that they have less free time to spend with their children.	Overall, parents do not complain that they have less free time to spend with their children.	They have less free time to spend with their children.	1.0,1.0,1.0	-1.0,0.0,1.0	0.99439603	0.0014038370999999998	0.0042000934	0.017811203	0.9675537	0.014635133	o/o
797	that	complain	Religious conservatives complain that the GOP has ignored their causes.	Religious conservatives do not complain that the GOP has ignored their causes.	The gop has ignored their causes.	0.0,0.0,0.0	-1.0,-1.0,0.0	0.99530846	0.0011490242	0.0035425844	0.9947052	0.0013114279	0.003983239600000001	o/o
798	that	complain	Traditionalists complain that it will make the rivalries less intense.	Traditionalists do not complain that it will make the rivalries less intense.	It will make the rivalries less intense.	0.0,1.0,1.0	0.0,0.0,1.0	0.99035275	0.0016928978	0.007954314	0.63431346	0.10225139	0.26343518	o/o
799	that	propose	The essay proposed that placing applicants would solve all of the courts' need 	The essay did not propose that placing applicants would solve all of the courts' need 	Placing applicants would solve all of the courts' need.	0.0,1.0,2.0	-1.0,0.0,0.0	0.9956102	0.00054303114	0.0038468286	0.0012031576	0.99549073	0.003306091	o/o
800	that	propose	An article proposed that the food stamp system is funding the war in Kosovo. 	An article did not propose that the food stamp system is funding the war in Kosovo. 	The food stamp system is funding the war in kosovo.	0.0,0.0,0.0	-2.0,-1.0,0.0	0.97517717	0.004661059	0.020161834	0.19882926	0.28147432	0.51969635	o/o
801	that	propose	We propose that it should take place to-morrow night, or rather to-night. 	We do not propose that it should take place to-morrow night, or rather to-night. 	It should take place to-morrow night.	-1.0,-1.0,2.0	-2.0,0.0,0.0	0.996101	0.0008878709599999998	0.0030111247	0.0018270763	0.9953733	0.0027995785	o/o
802	that	propose	Nicholas Copernicus proposed that the sun was the center of the universe.	Nicholas Copernicus did not propose that the sun was the center of the universe.	The sun was the center of the universe.	1.0,1.0,1.0	0.0,0.0,0.0	0.9847093	0.0028841812	0.01240648	0.0174618	0.95465016	0.027887989	o/o
803	that	propose	It was proposed that the allocations should no longer be fuel neutral.	It was not proposed that the allocations should no longer be fuel neutral.	The allocations should no longer be fuel neutral.	0.0,1.0,1.0	-2.0,-1.0,0.0	0.9954104	0.0017376754	0.0028519481	0.004336855	0.99092704	0.0047362535	o/o
804	that	propose	They proposed that the standard remained unchanged.	They did not propose that the standard remained unchanged.	The standard remained unchanged.	0.0,1.0,1.0	-1.0,0.0,0.0	0.99659353	0.00026452212	0.0031419233	0.002050554	0.99647164	0.0014778678	o/o
805	that	propose	USPS proposed that there should be decreases.	USPS did not propose that there should be decreases.	There should be decreases.	0.0,0.0,0.0	-2.0,-1.0,0.0	0.9957837	0.0005087051000000001	0.0037076324	0.0094514955	0.96856767	0.021980772000000003	o/o
806	that	request	When Clinton lawyer Bob Bennett requested that the Paula Jones trial begin sooner than scheduled, reporters construed it as a display of confidence.	When Clinton lawyer Bob Bennett did not request that the Paula Jones trial begin sooner than scheduled, reporters construed it as a display of confidence.	The paula jones trial begin sooner than scheduled.	0.0,0.0,0.0	0.0,0.0,2.0	0.976622	0.007714945999999999	0.015663003999999998	0.039603718	0.8757503000000001	0.08464596	o/o
807	that	request	GAO is requesting that the agencies provide their written comments electronically in order to comply with Section 508 of the Rehabilitation Act.	GAO is not requesting that the agencies provide their written comments electronically in order to comply with Section 508 of the Rehabilitation Act.	The agencies provide their written comments electronically in order to comply with section 508 of the rehabilitation act.	0.0,0.0,1.0	-1.0,0.0,1.0	0.995981	0.000912152	0.0031067552	0.3917335	0.42487624	0.18339016	o/o
808	that	speculate	As for Liggett's motive, industry and financial analysts speculated that Liggett's CEO hoped to make the marginally profitable company a more attractive merger partner by eliminating its exposure to possibly huge jury awards.	As for Liggett's motive, industry and financial analysts did not speculate that Liggett's CEO hoped to make the marginally profitable company a more attractive merger partner by eliminating its exposure to possibly huge jury awards.	Liggett's ceo hoped to make the marginally profitable company a more attractive merger partner by eliminating its exposure to possibly huge jury awards.	0.0,1.0,1.0	-1.0,0.0,1.0	0.9981055	0.000575597	0.0013188329	0.99651885	0.0012243206	0.0022569124	o/o
809	that	request	The National Treasury Employees Union requested that the IRS establish a program similar to the GSA's program in 2000.	The National Treasury Employees Union did not request that the IRS establish a program similar to the GSA's program in 2000.	The irs establish a program similar to the gsa's program in 2000.	0.0,0.0,1.0	-2.0,-1.0,0.0	0.99467754	0.0009303722	0.0043921424	0.003579005	0.99152803	0.0048929686	o/o
810	that	request	The lawyers requested that they remain anonymous.	The lawyers did not request that they remain anonymous.	They remain anonymous.	1.0,1.0,1.0	-1.0,0.0,0.0	0.9917806	0.0015389597	0.006680435500000001	0.01239423	0.9806639	0.0069418573	o/o
811	that	see	It is seen that there is a disproportionate number of small business addresses in Italy.	It is not seen that there is a disproportionate number of small business addresses in Italy.	There is a disproportionate number of small business addresses in italy.	2.0,2.0,2.0	-1.0,-1.0,1.0	0.9984314	0.00015066081	0.0014178907	0.65098184	0.13128036	0.2177378	+/+
812	that	demonstrate	Lubitz' demonstrated that the law targeted predominantly minority populations.	Lubitz' did not demonstrate that the law targeted predominantly minority populations.	The law targeted predominantly minority populations.	1.0,2.0,2.0	-2.0,-1.0,-1.0	0.99841195	0.00028748333	0.0013006256	0.8934964	0.038824774	0.06767885	+/o
813	that	explain	It was explained that golf was something that relaxed Ike and therefore helped his performance improve. 	It was not explained that golf was something that relaxed Ike and therefore helped his performance improve. 	Golf was something that relaxed ike and therefore helped his performance improve.	2.0,2.0,2.0	1.0,1.0,1.0	0.99852496	0.00021989494	0.0012551855	0.9971302	0.0005351602	0.0023346527	o/+
814	that	worry	I was worried that my luck was too good to be true.	I was not worried that my luck was too good to be true.	My luck was too good to be true.	0.0,0.0,1.0	-2.0,-1.0,0.0	0.30359970000000003	0.11273859	0.5836618	0.22697535	0.10421097	0.66881365	o/o
815	that	hope	I hope that the plan happens after I retire. 	I do not hope that the plan happens after I retire. 	The plan happens after i retire.	0.0,0.0,0.0	-1.0,-1.0,0.0	0.9802804	0.0056859083	0.01403366	0.0035047897	0.9921798	0.0043153292	o/o
816	that	hope	We hope that there are no more fires. 	We do not hope that there are no more fires. 	There are no more fires.	0.0,0.0,0.0	-2.0,-1.0,0.0	0.47643787	0.18179874	0.34176338	0.25462976	0.4997505	0.24561974	o/o
817	that	hope	I really hope that it will not.	I really do not hope that it will not.	It will not.	-1.0,0.0,2.0	-1.0,0.0,0.0	0.99021655	0.0015667551	0.008216747	0.6344314999999999	0.12483352	0.24073501	o/o
818	that	add	DiClemente added that his study was also for both groups and most primary care studies involve non-injured patients.	DiClemente did not add that his study was also for both groups and most primary care studies involve non-injured patients.	His study was also for both groups.	1.0,2.0,2.0	0.0,0.0,2.0	0.99805	0.00030096102	0.0016489610999999998	0.9972101	0.0004056446	0.0023843057	o/+
819	that	add	One participant added that the current regulatory structure has dampened the profession's spirit for innovation.	One participant did not add that the current regulatory structure has dampened the profession's spirit for innovation.	The current regulatory structure has dampened the profession's spirit for innovation.	1.0,1.0,2.0	1.0,2.0,2.0	0.99810994	0.00038894854	0.0015010703	0.99602276	0.0009226021	0.0030546722	o/+
820	that	add	Daniel Pollock added that the message of the recommendations could also be conveyed at professional meetings.	Daniel Pollock did not add that the message of the recommendations could also be conveyed at professional meetings.	The message of the recommendations could also be conveyed at professional meetings.	1.0,1.0,2.0	-1.0,0.0,1.0	0.9982697	0.00018958643	0.0015406851	0.99493533	0.0005330501	0.004531722	o/+
821	that	add	Hugeford had added that the recommendation was definitely that integration gave better estimates.	Hugeford had not added that the recommendation was definitely that integration gave better estimates.	The recommendation was definitely that integration gave better estimates.	1.0,2.0,2.0	1.0,1.0,1.0	0.99790883	0.00017780476999999998	0.001913337	0.99675375	0.00028597686	0.0029601718	o/+
822	that	add	Dan Quayle called the drug story a side show but added that Bush's wounds were self-inflicted.	Dan Quayle called the drug story a side show but did not add that Bush's wounds were self-inflicted.	Bush's wounds were self-inflicted.	-1.0,1.0,1.0	-1.0,1.0,2.0	0.98767626	0.0010987944	0.011224972	0.031212365	0.0034552056	0.96533245	o/+
823	that	add	Hargarten added that tele-medicine has a role in making the booster intervention a reality.	Hargarten did not add that tele-medicine has a role in making the booster intervention a reality.	Tele-medicine has a role in making the booster intervention a reality.	-2.0,1.0,1.0	0.0,0.0,2.0	0.9983449	0.00023782822	0.0014172964	0.9966714	0.0004076807	0.0029209626	o/+
824	that	add	Hungerford added that the trauma care setting should be included as well.	Hungerford did not add that the trauma care setting should be included as well.	The trauma care setting should be included as well.	1.0,2.0,2.0	-1.0,0.0,1.0	0.99849415	0.00019017259	0.0013156309	0.63557017	0.044371188	0.32005867	o/+
825	that	add	Linda Degutis added that interventions have to be monitored.	Linda Degutis did not add that interventions have to be monitored.	Interventions have to be monitored.	1.0,2.0,2.0	0.0,0.0,0.0	0.9980786	0.00014425186	0.0017771845000000004	0.9945379	0.0004513672599999999	0.005010744	o/+
826	that	recommend	The American Bar Association recommends that private firm attorneys contribute 50 hours per year to pro bono work.	The American Bar Association does not recommend that private firm attorneys contribute 50 hours per year to pro bono work.	Private firm attorneys contribute 50 hours per year to pro bono work.	0.0,0.0,0.0	0.0,0.0,0.0	0.9958133	0.0008430453599999999	0.00334359	0.0047869086	0.98834354	0.0068696183	o/o
827	that	recommend	In any case, we recommend that you choose from at least two of them, ideally three, when planning your menu. 	In any case, we do not recommend that you choose from at least two of them, ideally three, when planning your menu. 	You choose from at least two of them, ideally three, when planning your menu.	0.0,0.0,1.0	0.0,0.0,1.0	0.9978908	0.0004694873	0.0016396835	0.0036015625	0.9919766	0.0044217813	o/o
828	that	recommend	We recommended that OMB should veto the CIO Council's adoption of information security.	We did not recommend that OMB should veto the CIO Council's adoption of information security.	Omb should veto the cio council's adoption of information security.	0.0,1.0,1.0	-1.0,-1.0,0.0	0.99795496	0.0006748914999999999	0.0013701825	0.0016253012	0.995639	0.002735685	o/o
829	that	seem	It seems that the city walls indicate that it was built in 1349.	It does not seem that the city walls indicate that it was built in 1349.	The city walls indicate that it was built in 1349.	1.0,1.0,2.0	-1.0,-1.0,-1.0	0.99859804	0.00040736052	0.0009946343	0.00024256490000000005	0.9992053	0.00055220275	o/o
830	that	seem	It seemed that a slight bump would send it tumbling down.	It did not seem that a slight bump would send it tumbling down.	A slight bump would send it tumbling down.	0.0,1.0,1.0	0.0,0.0,1.0	0.9973883	0.00052180415	0.0020898446	0.0019161024	0.99532014	0.0027637812	o/o
831	that	seem	It seemed that the old Sather knew without looking back.	It did not seem that the old Sather knew without looking back.	The old sather knew without looking back.	1.0,2.0,2.0	-1.0,-1.0,0.0	0.99727494	0.0010995087	0.0016255579999999998	0.0020256618	0.99579334	0.0021810431	o/o
832	that	seem	To funders, sadly, it seems that it is a zero sum game.	To funders, sadly, it does not seem that it is a zero sum game.	It is a zero sum game.	0.0,1.0,2.0	-1.0,0.0,1.0	0.9859565999999998	0.002785416	0.011257832	0.005276954300000001	0.98624694	0.008476105500000001	o/o
833	that	seem	It seemed that Bork was the principal conjurer.	It did not seem that Bork was the principal conjurer.	Bork was the principal conjurer.	0.0,1.0,1.0	-1.0,0.0,0.0	0.9962566	0.0010832968	0.0026601178000000003	0.00079355814	0.99807477	0.0011316442	o/o
834	that	seem	It seems that everyone in England is gay.	It does not seem that everyone in England is gay.	Everyone in england is gay.	-1.0,-1.0,0.0	-1.0,0.0,0.0	0.9962669	0.00036299726	0.0033701698	0.00041461506	0.99843603	0.0011493613	o/o
835	that	seem	It seems that it passed the first test.	It does not seem that it passed the first test.	It passed the first test.	1.0,1.0,1.0	-2.0,-1.0,-1.0	0.99643	0.0003821672	0.0031879432	0.0034143943	0.99149066	0.005094952	o/o
836	that	worry	 You really worry that you may be told you're in the wrong place?	 You really do not worry that you may be told you're in the wrong place?	You may be told you're in the wrong place.	0.0,0.0,0.0	0.0,0.0,2.0	0.9959837	0.00028432847	0.0037319628	0.9963289	0.00033411977	0.0033369812	o/o
837	that	worry	He was worried that any other yogurt would ruin his experiments.	He was not worried that any other yogurt would ruin his experiments.	Any other yogurt would ruin his experiments.	0.0,0.0,1.0	-1.0,0.0,0.0	0.9740416	0.005385614499999999	0.020572705	0.0012074942	0.9960051	0.0027873982	o/o
838	that	worry	The customers worry that the states will face budget issues.	The customers do not worry that the states will face budget issues.	The states will face budget issues.	0.0,0.0,0.0	-1.0,0.0,2.0	0.6081850000000001	0.004371849000000001	0.38744316	0.92942387	0.0046446790000000005	0.06593151400000001	o/o
839	that	worry	I was worried that Mrs. Inglethorp had changed her will.	I was not worried that Mrs. Inglethorp had changed her will.	Mrs. inglethorp had changed her will.	0.0,0.0,0.0	0.0,1.0,2.0	0.9867935	0.0013202367	0.011886362	0.98137367	0.0029740303000000004	0.015652241	o/o
