index	task	verb	sentence	neg_sentence	complement	turker_pos_ratings	turker_neg_ratings	bert_pos_entailment_prob	bert_pos_contradiction_prob	bert_pos_neutral_prob	bert_neg_entailment_prob	bert_neg_contradiction_prob	bert_neg_neutral_prob	signature
395	to	dare	Steve Roberts medals in singles competition for shoehorning his opinion that presidential diplomacy is indispensable in the New World Order into both Washington Week in Review and Late Edition . Never one for complacency, he teams up with his wife, Cokie Roberts of This Week , for the doubles  The pair repeat the prediction that even privatization-friendly Dems will cynically whack GOP candidates who dare to support privatizing Social Security.	Steve Roberts medals in singles competition for shoehorning his opinion that presidential diplomacy is indispensable in the New World Order into both Washington Week in Review and Late Edition . Never one for complacency, he teams up with his wife, Cokie Roberts of This Week , for the doubles  The pair repeat the prediction that even privatization-friendly Dems will cynically whack GOP candidates who do not dare to support privatizing Social Security.	Steve roberts medals in singles competition for shoehorning his opinion that presidential diplomacy is indispensable in the new world order into both washington week in review and late edition . never one for complacency, he teams up with his wife, cokie roberts of this week, for the doubles the pair repeat the prediction that even privatization-friendly dems will cynically whack gop candidates who support privatizing social security.	0.0,2.0,2.0	-1.0,-1.0,1.0	0.99753016	0.0015628507999999998	0.0009070035	0.99753016	0.0015628507999999998	0.0009070035	+/-
396	to	dare	Sand and sun Cuba certainly has, but most visitors who dare to step away from the beach will find it simply too beguiling to spend a whole holiday lying idly in front of their hotels.	Sand and sun Cuba certainly has, but most visitors who do not dare to step away from the beach will find it simply too beguiling to spend a whole holiday lying idly in front of their hotels.	Sand and sun cuba certainly has, but most visitors who step away from the beach will find it simply too beguiling to spend a whole holiday lying idly in front of their hotels.	-2.0,0.0,2.0	-2.0,-1.0,0.0	0.9986374	0.00063169515	0.0007309671	0.99827874	0.0009232475	0.00079804414	+/-
397	to	dare	San'doro moved like wind, cutting saddles off of horses, cutting the arms that dared to attack him, and the throats of the fallen.	San'doro moved like wind, cutting saddles off of horses, cutting the arms that did not dare to attack him, and the throats of the fallen.	San ` doro moved like wind, cutting saddles off of horses, cutting the arms that attacked him, and the throats of the fallen.	1.0,2.0,2.0	-1.0,1.0,2.0	0.9987754	0.0005816615	0.0006429876	0.99855834	0.0007966749	0.0006449768599999999	+/-
398	to	dare	The secret of these fish is so well kept that no emperor has dared to take control lest this secret become lost.	The secret of these fish is so well kept that no emperor has not dared to take control lest this secret become lost.	The secret of these fish is so well kept that no emperor has taken control lest this secret become lost.	1.0,2.0,2.0	-1.0,2.0,2.0	0.9986431999999998	0.0005523316000000001	0.0008044025	0.9982279	0.0009185077	0.0008535136	+/-
399	to	dare	Piedmont became a haven for political exiles, as none of their enemies dared to look for them here.	Piedmont became a haven for political exiles, as none of their enemies did not dare to look for them here.	Piedmont became a haven for political exiles, as none of their enemies looked for them here.	2.0,2.0,2.0	0.0,2.0,2.0	0.99862385	0.00070304	0.0006730525	0.9978643	0.00119226	0.0009434387	+/-
400	to	dare	No participants dared to suggest that serving as a director should be a salaried position.	No participants did not dare to suggest that serving as a director should be a salaried position.	No participants suggested that serving as a director should be a salaried position.	2.0,2.0,2.0	-1.0,1.0,2.0	0.9982266	0.00081804727	0.00095541205	0.99635684	0.0021465393	0.0014966284	+/-
401	to	move	He moved to look at me and took out his tobacco.	He did not move to look at me and took out his tobacco.	He looked at me and took out his tobacco.	1.0,1.0,1.0	-1.0,-1.0,-1.0	0.9985888	0.0006589950999999999	0.0007522579	0.6718743	0.3209967	0.0071289493	o/o
402	to	move	Now they've got us flanked, they're probably moving to find you.'	Now they've got us flanked, they're probably not moving to find you.'	Now they've got us flanked, they're probably finding you ..	0.0,1.0,2.0	-2.0,-1.0,0.0	0.99783915	0.00051753887	0.0016433152	0.00067753927	0.99837095	0.0009515312	o/o
403	to	pretend	Whittington was doing a bad job pretending to be a gardener.	Whittington was doing a bad job not pretending to be a gardener.	Whittington was doing a bad job being a gardener.	-1.0,1.0,1.0	1.0,2.0,2.0	0.995089	0.0012300051	0.0036809917	0.9946418	0.0017815601	0.0035766587	o/o
404	to	proceed	The most prominent member of the gathering went by the single name of Drake and proceeded to wear a sad expression throughout the proceedings. 	The most prominent member of the gathering went by the single name of Drake and did not proceed to wear a sad expression throughout the proceedings. 	The most prominent member of the gathering went by the single name of drake and wore a sad expression throughout the proceedings.	2.0,2.0,2.0	-2.0,-1.0,-1.0	0.99849916	0.0007173952000000001	0.0007834197000000001	0.0004271753	0.9990257	0.00054707384	o/o
405	to	proceed	We proceed to explore the relative roles of postal density and volume as delivery cost drivers.	We do not proceed to explore the relative roles of postal density and volume as delivery cost drivers.	We explore the relative roles of postal density and volume as delivery cost drivers.	2.0,2.0,2.0	-1.0,-1.0,-1.0	0.9980794	0.0009666183	0.0009540251	0.00024360682	0.99938285	0.0003734565	o/o
406	to	proceed	He took a banana from his pocket, and proceeded to read it. 	He took a banana from his pocket, and did not proceed to read it. 	He took a banana from his pocket, and read it.	1.0,2.0,2.0	-1.0,-1.0,-1.0	0.9987344	0.00033629022000000004	0.0009292927	0.0001591861	0.9995976	0.00024316896	o/o
407	to	proceed	Jon bowed and proceeded to leave the premises.	Jon bowed and did not proceed to leave the premises.	Jon bowed and leaved the premises.	1.0,2.0,2.0	-2.0,-2.0,-1.0	0.99879766	0.0006367703	0.00056558184	0.00020619622	0.99956626	0.00022754622000000004	o/o
408	to	proceed	White then proceeded to pour a glass of wine.	White then did not proceed to pour a glass of wine.	White then poured a glass of wine.	2.0,2.0,2.0	-2.0,-2.0,-2.0	0.9989537	0.00034363012000000005	0.0007025426600000001	0.00016568389	0.99941325	0.0004210715	o/o
409	to	proceed	I then proceeded to drink some tea and sleep.	I then did not proceed to drink some tea and sleep.	I then drank some tea and sleep.	2.0,2.0,2.0	-2.0,-2.0,-2.0	0.99889874	0.00029218127	0.0008090571000000001	0.000255455	0.9990375	0.0007070587599999999	o/o
410	to	proceed	They proceeded to resist against the demons.	They did not proceed to resist against the demons.	They resisted against the demons.	1.0,2.0,2.0	-2.0,-2.0,-1.0	0.9988617	0.00031447102	0.0008238653	0.00036046456	0.9991222	0.0005173332	o/o
411	to	proceed	I proceeded to reason on that assumption. 	I did not proceed to reason on that assumption. 	I reasoned on that assumption.	2.0,2.0,2.0	-2.0,-2.0,-1.0	0.99883765	0.00019143632	0.0009709396	0.00012928456	0.9996737	0.00019696204	o/o
412	to	move	Programs have already moved to carry out some of the Plan's recommendations.	Programs have already not moved to carry out some of the Plan's recommendations.	Programs have already carried out some of the plan's recommendations.	0.0,1.0,2.0	-1.0,-1.0,-1.0	0.9986914	0.00018053669	0.001128147	0.25341952	0.15160365	0.59497684	o/o
413	to	return	They returned to live in the Galilee village of Nazareth, making pilgrimages to Jerusalem.	They did not return to live in the Galilee village of Nazareth, making pilgrimages to Jerusalem.	They lived in the galilee village of nazareth, making pilgrimages to jerusalem.	2.0,2.0,2.0	-2.0,-2.0,-1.0	0.99821943	0.0011398814	0.00064063637	0.9968449	0.0023941859	0.00076102273	o/o
414	to	return	Regardless of the murder that had occurred days earlier, she returned to work that day. 	Regardless of the murder that had occurred days earlier, she did not return to work that day. 	Regardless of the murder that had occurred days earlier, she worked that day.	1.0,2.0,2.0	-2.0,-1.0,-1.0	0.9971042	0.0016876195000000002	0.001208105	0.0001606196	0.9995881	0.0002513416	o/o
415	to	return	I returned to work but my mind continued to wander to the old crone and the young girl.	I did not return to work but my mind continued to wander to the old crone and the young girl.	I worked but my mind continued to wander to the old crone and the young girl.	1.0,1.0,2.0	-2.0,-1.0,-1.0	0.99853694	0.0005666904	0.0008963822999999998	0.0023253693	0.9963979	0.00127677	o/o
416	to	return	When they returned to regroup after a storm, there was a dispute over property.	When they did not return to regroup after a storm, there was a dispute over property.	When they regrouped after a storm, there was a dispute over property.	1.0,2.0,2.0	-2.0,-1.0,-1.0	0.9987999	0.00048704154	0.0007129421000000001	0.19435447	0.8025817	0.003063746	o/o
417	to	return	The investigator took a break but soon returned to ask more questions.	The investigator took a break but soon did not return to ask more questions.	The investigator took a break but soon asked more questions.	1.0,1.0,2.0	-2.0,-2.0,-1.0	0.99872714	0.00055775954	0.0007150336999999999	0.0005264816599999999	0.99864477	0.0008288615499999999	o/o
418	to	move	Yet simultaneously, there was the social activism of the Warren Court, and a national administration moved to declare a more worthy campaign in 1964: the War on Poverty.	Yet simultaneously, there was the social activism of the Warren Court, and a national administration did not move to declare a more worthy campaign in 1964: the War on Poverty.	Yet simultaneously, there was the social activism of the warren court, and a national administration declared a more worthy campaign in 1964 : the war on poverty.	0.0,1.0,1.0	-2.0,-1.0,-1.0	0.99858344	0.0005568595	0.0008597418	0.00036072097	0.9990422	0.00059697975	o/o
419	to	move	However, as we moved to address the Board's mandate, we quickly realized that the creation of a world-class delivery system involved more than state planning, per se.	However, as we did not move to address the Board's mandate, we quickly realized that the creation of a world-class delivery system involved more than state planning, per se.	However, as we addrest the board's mandate, we quickly realized that the creation of a world-class delivery system involved more than state planning, per se.	0.0,1.0,2.0	-2.0,-1.0,0.0	0.9980311	0.0011741082000000002	0.0007947687	0.97044796	0.027157499	0.0023946322	o/o
420	to	move	And the Association of Trial Lawyers of America has moved to assist families free of charge when they go file for federal aid.	And the Association of Trial Lawyers of America has not moved to assist families free of charge when they go file for federal aid.	And the association of trial lawyers of america has assisted families free of charge when they go file for federal aid.	0.0,0.0,1.0	-2.0,-1.0,-1.0	0.99803096	0.00092088344	0.0010481174	0.00021571742	0.9993236	0.00046064198	o/o
421	to	dare	Against his own advice, Ca'daan dared to stare off the edge once as they neared the end.	Against his own advice, Ca'daan did not dare to stare off the edge once as they neared the end.	Against his own advice, ca ` daan stared off the edge once as they neared the end.	1.0,2.0,2.0	-2.0,-1.0,-1.0	0.9986584	0.00046816096	0.0008734347	0.00028482117	0.9993297	0.00038551947	+/-
422	to	dare	He dared to look up.	He did not dare to look up.	He looked up.	1.0,2.0,2.0	-2.0,-2.0,-2.0	0.99717665	0.00028393330000000004	0.0025393185	0.00015574317	0.9996426	0.00020157988	+/-
423	to	cease	Although it ceased to be a political capital in 1707 -lrb-when Scotland joined with England to create the United Kingdom-rrb-, Edinburgh was at the forefront of intellectual debate.	Although it did not cease to be a political capital in 1707 -lrb-when Scotland joined with England to create the United Kingdom-rrb-, Edinburgh was at the forefront of intellectual debate.	Although it was a political capital in 1707 -lrb- when scotland joined with england to create the united kingdom -rrb-, edinburgh was at the forefront of intellectual debate.	-2.0,1.0,2.0	1.0,1.0,2.0	0.9872959	0.011581931	0.0011221801	0.9987406	0.00057417894	0.0006852023	o/o
424	to	hope	We hope to institute many more initiatives to increase access to justice.	We do not hope to institute many more initiatives to increase access to justice.	We institute many more initiatives to increase access to justice.	0.0,0.0,1.0	-1.0,-1.0,-1.0	0.9926872	0.0007999971	0.006512836	0.00012517258	0.9995845	0.0002903815	o/o
425	to	hope	Take 2 is the starting point, and we hope to establish an endowment.	Take 2 is the starting point, and we do not hope to establish an endowment.	Take 2 is the starting point, and we establish an endowment.	0.0,1.0,2.0	-2.0,-1.0,0.0	0.9964005	0.0015222904	0.002077239	0.0005531047	0.9987172	0.0007296424000000001	o/o
426	to	hope	We hope to introduce additional companion projects in the future.	We do not hope to introduce additional companion projects in the future.	We introduce additional companion projects in the future.	0.0,0.0,1.0	-2.0,-1.0,-1.0	0.9454669	0.0074789943000000015	0.04705413	0.00026021572	0.9991056	0.00063420343	o/o
427	to	hope	I hope to gather many elderberries on my walk through the woods.	I do not hope to gather many elderberries on my walk through the woods.	I gather many elderberries on my walk through the woods.	0.0,0.0,0.0	-1.0,0.0,0.0	0.9893951	0.0010044428	0.009600523	0.00028104414	0.998899	0.0008200180599999999	o/o
428	to	hope	I am in your debt and still hope to call on you in the future.	I am in your debt and still do not hope to call on you in the future.	I am in your debt and still call on you in the future.	0.0,1.0,1.0	-1.0,-1.0,0.0	0.9978237	0.0008173405700000001	0.0013590496	0.0002928692	0.9992874	0.00041971367	o/o
429	to	hope	Republicans hope to attract black voters with the issue.	Republicans do not hope to attract black voters with the issue.	Republicans attract black voters with the issue.	0.0,0.0,0.0	-1.0,-1.0,0.0	0.99336994	0.0022882186	0.004341859	0.00033966562000000013	0.9987098	0.0009505194	o/o
430	to	cease	The theater has ceased to be the place where Americans explore issues of the kind raised by Death of a Salesman . But Miller's failure is ultimately his own.	The theater has not ceased to be the place where Americans explore issues of the kind raised by Death of a Salesman . But Miller's failure is ultimately his own.	The theater has been the place where americans explore issues of the kind raised by death of a salesman . but miller's failure is ultimately his own.	0.0,0.0,1.0	1.0,1.0,2.0	0.9965094	0.002706736	0.000783897	0.9986945	0.0005915767400000001	0.0007139055499999999	o/o
431	to	propose	Richard Lugar, who chairs the Agriculture Committee, proposes to buy them out over a few years and then leave tobacco to the market.	Richard Lugar, who chairs the Agriculture Committee, does not propose to buy them out over a few years and then leave tobacco to the market.	Richard lugar, who chairs the agriculture committee, buys them out over a few years and then leave tobacco to the market.	0.0,0.0,1.0	-1.0,0.0,0.0	0.99758923	0.0008544457	0.001556303	0.00021488	0.99940956	0.00037550033	o/o
432	to	propose	She proposees to pay Robert Novak $1 per minute to keep his yap shut, later on in the show.	She does not proposee to pay Robert Novak $1 per minute to keep his yap shut, later on in the show.	She pays robert novak $ 1 per minute to keep his yap shut, later on in the show.	0.0,1.0,2.0	-1.0,-1.0,0.0	0.9980812	0.0006708582	0.0012479997	0.0008956456	0.9977901	0.0013141967	o/o
433	to	propose	The Commission proposed to change a commission rule about medical device compatibility.	The Commission did not propose to change a commission rule about medical device compatibility.	The commission changed a commission rule about medical device compatibility.	0.0,0.0,1.0	-2.0,-1.0,0.0	0.99739176	0.00049773237	0.0021105060000000003	0.00041925456	0.9988933	0.0006874845	o/o
434	to	propose	Therefore, GAGAS simply proposes to recognize the reality of current practice.	Therefore, GAGAS simply does not propose to recognize the reality of current practice.	Therefore, gagas simply recognizes the reality of current practice.	0.0,0.0,1.0	-2.0,-1.0,-1.0	0.98927975	0.0032705364	0.0074497373	0.00014147546999999998	0.9995927	0.00026583194	o/o
435	to	propose	You heard me say yesterday that I proposed to live by my wits.	You heard me say yesterday that I did not propose to live by my wits.	You heard me say yesterday that i lived by my wits.	0.0,0.0,0.0	-1.0,1.0,1.0	0.9960747	0.0018407705	0.0020845823000000003	0.00020653104	0.9994523	0.00034117754000000003	o/o
436	to	propose	It was after that that Tommy proposed to give them a surprise.	It was after that that Tommy did not propose to give them a surprise.	It was after that that tommy gave them a surprise.	0.0,1.0,1.0	-2.0,-2.0,0.0	0.9978401	0.0011478353	0.0010119951	0.0002007835	0.9995098	0.00028947485000000003	o/o
437	to	propose	I propose to reason in a logical manner.	I do not propose to reason in a logical manner.	I reason in a logical manner.	0.0,1.0,2.0	-2.0,-1.0,0.0	0.99022996	0.0011822779	0.008587788	0.00030640588	0.99895304	0.0007406286999999999	o/o
438	to	deserve	Starr deserves to be investigated. 	Starr does not deserve to be investigated. 	Starr is investigated.	-2.0,0.0,0.0	-2.0,0.0,0.0	0.9923742	0.00064029865	0.006985452	0.9471884	0.025174381000000003	0.027637301	o/o
439	to	deserve	The voters deserve to know the truth. 	The voters do not deserve to know the truth. 	The voters know the truth.	-1.0,-1.0,0.0	0.0,0.0,0.0	0.20681116	0.21489063	0.5782982	0.0005387453	0.9982961	0.0011651722	o/o
440	to	deserve	The Kennedys deserve to have the family curse upon them.	The Kennedys do not deserve to have the family curse upon them.	The kennedys have the family curse upon them.	-1.0,0.0,2.0	0.0,0.0,1.0	0.9906858	0.0032852087	0.0060291016000000005	0.99077684	0.0044609252	0.0047622668	o/o
441	to	cease	When Edinburgh ceased to be a political capital in the early 18th century, local political figures protested for a change in their infrastructure.	When Edinburgh did not cease to be a political capital in the early 18th century, local political figures protested for a change in their infrastructure.	When edinburgh was a political capital in the early 18th century, local political figures protested for a change in their infrastructure.	-2.0,-2.0,0.0	1.0,2.0,2.0	0.99636084	0.002793736	0.0008454086	0.99874264	0.0005906158999999999	0.0006666845299999999	o/o
442	to	cease	Julius Caesar's nephew Octavian took the name Augustus; Rome ceased to be a republic, and became an empire.	Julius Caesar's nephew Octavian took the name Augustus; Rome did not cease to be a republic, and became an empire.	Julius caesar's nephew octavian took the name augustus ; rome was a republic, and became an empire.	1.0,2.0,2.0	1.0,2.0,2.0	0.99815434	0.0011714542	0.0006741528	0.99861467	0.0006864949	0.0006988033400000001	o/o
443	to	cease	What made you think he'd ceased to take any interest in the case? asked Tommy curiously.	What made you think he'd not ceased to take any interest in the case? asked Tommy curiously.	What made you think he'd taken any interest in the case? asked tommy curiously.	-2.0,-1.0,2.0	-2.0,1.0,2.0	0.20297407	0.79375124	0.0032746892	0.99820673	0.00064387877	0.0011493934	o/o
444	to	cease	A day after that, he disappeared, or rather ceased to be visible.	A day after that, he disappeared, or rather did not cease to be visible.	A day after that, he disappeared, or rather was visible.	-2.0,-2.0,-2.0	-1.0,1.0,2.0	0.00039236405	0.99908376	0.00052395114	0.99845576	0.00047728574	0.0010669625999999998	o/o
445	to	cease	White ethnics have ceased to be the dominant force in urban life.	White ethnics have not ceased to be the dominant force in urban life.	White ethnics have been the dominant force in urban life.	-2.0,1.0,2.0	1.0,1.0,2.0	0.0002713295	0.99923253	0.0004960862	0.9986462	0.0003778109	0.000975914	o/o
446	to	cease	The settlement for whatever reason ceased to become permanent.	The settlement for whatever reason did not cease to become permanent.	The settlement for whatever reason became permanent.	-2.0,-2.0,-2.0	-1.0,1.0,1.0	0.00019513452	0.99950624	0.00029864346	0.9939011	0.0013123996	0.004786466	o/o
447	to	exist	Another favorite Republican cause is the Small Business Administration, which exists to make loans to companies that banks deem nonviable.	Another favorite Republican cause is the Small Business Administration, which does not exist to make loans to companies that banks deem nonviable.	Another favorite republican cause is the small business administration, which makes loans to companies that banks deem nonviable.	1.0,1.0,2.0	-2.0,-1.0,0.0	0.9985276	0.0005230626	0.00094943214	0.0003030239	0.9990847	0.00061229855	o/o
448	to	exist	Welldeveloped techniques exist to provide monetary estimates of these benefits to agricultural producers and consumers.	Welldeveloped techniques do not exist to provide monetary estimates of these benefits to agricultural producers and consumers.	Welldeveloped techniques provide monetary estimates of these benefits to agricultural producers and consumers.	1.0,2.0,2.0	-2.0,-2.0,2.0	0.9985668	0.0002935792	0.00113963	0.00021377021	0.9993117	0.00047455003	o/o
449	to	exist	The Legal Services Corporation exists to help our clients address their legal wrongs and promote their legal rights.	The Legal Services Corporation does not exist to help our clients address their legal wrongs and promote their legal rights.	The legal services corporation helps our clients address their legal wrongs and promote their legal rights.	1.0,1.0,2.0	-2.0,-1.0,0.0	0.998406	0.00026264755	0.0013313276999999998	0.0001856231	0.9994568	0.00035758805	o/o
450	to	exist	The agency's inhouse facility engineering staff exist to support the agency's mission.	The agency's inhouse facility engineering staff do not exist to support the agency's mission.	The agency's inhouse facility engineering staff support the agency's mission.	1.0,1.0,2.0	-2.0,-1.0,-1.0	0.99850094	0.00030218097	0.0011968918	0.00017624119999999998	0.9994425	0.00038127074	o/o
451	to	exist	Sufficient accumulated supply exists to meet demand.	Sufficient accumulated supply does not exist to meet demand.	Sufficient accumulated supply meets demand.	1.0,1.0,2.0	-2.0,0.0,0.0	0.9974636999999998	0.00030020298	0.0022360785	0.00014560146	0.99957246	0.0002819189	o/o
452	to	exist	Governments exist to limit personal freedom.	Governments do not exist to limit personal freedom.	Governments limit personal freedom.	1.0,1.0,2.0	-1.0,0.0,0.0	0.99735785	0.0006372312999999999	0.00200486	0.0006369959	0.9981109	0.0012521249	o/o
453	to	decline	NBC have declined to promote the show.	NBC have not declined to promote the show.	Nbc have promoted the show.	-2.0,-1.0,0.0	-1.0,0.0,0.0	0.00012968243	0.9996462	0.00022413873	0.9953799	0.0015608072	0.003059312	-/o
454	to	deserve	Deukemjian is a fool and a liar, and deserves to be strung by his balls.	Deukemjian is a fool and a liar, and does not deserve to be strung by his balls.	Deukemjian is a fool and a liar, and is strung by his balls.	-1.0,0.0,0.0	0.0,0.0,0.0	0.99785304	0.0008508767999999999	0.001296157	0.91083014	0.08375698	0.005412891	o/o
455	to	deserve	The public deserves to know what's going on with its money.	The public does not deserve to know what's going on with its money.	The public knows what's going on with its money.	-2.0,0.0,0.0	-2.0,-1.0,0.0	0.70837355	0.04497144	0.24665493	0.00053828175	0.9984426	0.0010192454	o/o
456	to	proceed	When a college audience annoys him by clamoring for Latka and Mighty Mouse, Carrey as Kaufman proceeds to read all of The Great Gatsby on stage.	When a college audience annoys him by clamoring for Latka and Mighty Mouse, Carrey as Kaufman does not proceed to read all of The Great Gatsby on stage.	When a college audience annoys him by clamoring for latka and mighty mouse, carrey as kaufman reads all of the great gatsby on stage.	2.0,2.0,2.0	-2.0,-2.0,-1.0	0.99819857	0.0008761621	0.00092529145	0.00029881217	0.99909437	0.0006068487	o/o
457	to	proceed	The island is aligned almost east-to-west in the water so that sunrise wakes the eastern tip, proceeds to caress the length of the island, and kisses the western tip  good night.  	The island is aligned almost east-to-west in the water so that sunrise wakes the eastern tip, does not proceed to caress the length of the island, and kisses the western tip  good night.  	The island is aligned almost east-to-west in the water so that sunrise wakes the eastern tip, caresses the length of the island, and kisses the western tip good night.	2.0,2.0,2.0	-2.0,-1.0,2.0	0.9986543	0.00048400863	0.0008616709	0.00026583133	0.99935967	0.00037455873	o/o
458	to	want	But I wanted to be sure.	But I did not want to be sure.	But i was sure.	-1.0,0.0,0.0	0.0,0.0,0.0	0.002573788	0.98920053	0.008225795	0.00012477237	0.99964786	0.00022742944	o/o
459	to	appear	She appears to be an intelligent woman.	She does not appear to be an intelligent woman.	She is an intelligent woman.	1.0,1.0,1.0	-1.0,0.0,0.0	0.98730695	0.0003219253	0.012371194	0.00020739679	0.9990785	0.0007141407000000001	o/o
